{
  "$schema": "https://json-schema.org/draft/2020-12/schema",
  "$id": "https://manga-gong-bang-video.local/schemas/export-meta.schema.json",
  "title": "MangaGongBangExportMeta",
  "type": "object",
  "additionalProperties": false,
  "required": ["schemaVersion", "source", "exportedAt", "project", "pages"],
  "properties": {
    "schemaVersion": { "const": "1.0" },
    "source": { "type": "string", "minLength": 1 },
    "exportedAt": { "type": "string", "minLength": 1 },
    "project": {
      "type": "object",
      "additionalProperties": false,
      "required": ["title", "genre", "tone", "language"],
      "properties": {
        "title": { "type": "string", "minLength": 1 },
        "genre": { "type": "string", "minLength": 1 },
        "tone": { "type": "string", "minLength": 1 },
        "language": { "type": "string", "minLength": 2 },
        "stylePreset": { "type": "string" },
        "stylePrompt": { "type": "string" }
      }
    },
    "characters": {
      "type": "array",
      "items": {
        "type": "object",
        "additionalProperties": false,
        "required": ["role", "desc", "imageFile"],
        "properties": {
          "role": { "enum": ["hero", "friend", "friend2"] },
          "name": { "type": "string" },
          "desc": { "type": "string", "minLength": 1 },
          "imageFile": { "type": "string", "minLength": 1 },
          "outfit": { "type": "string" },
          "props": { "type": "string" }
        }
      }
    },
    "pages": {
      "type": "array",
      "minItems": 1,
      "items": {
        "type": "object",
        "additionalProperties": false,
        "required": ["id", "type", "pageIndex", "imageFile", "beat"],
        "properties": {
          "id": { "type": "string", "minLength": 1 },
          "type": { "enum": ["cover", "story", "back_cover"] },
          "pageIndex": { "type": "integer", "minimum": 0 },
          "imageFile": { "type": "string", "minLength": 1 },
          "isDecisionPage": { "type": "boolean" },
          "resolvedChoice": { "type": "string" },
          "beat": {
            "type": "object",
            "additionalProperties": false,
            "required": ["scene"],
            "properties": {
              "scene": { "type": "string" },
              "dialogue": { "type": "string" },
              "caption": { "type": "string" },
              "focus_char": { "enum": ["hero", "friend", "friend2", "other"] },
              "choices": {
                "type": "array",
                "items": { "type": "string" }
              }
            }
          }
        }
      }
    }
  }
}
